{
  "$schema": "https://json-schema.org/draft/2020-12/schema",
  "$id": "https://lattice.dev/schemas/entity.schema.json",
  "title": "RpgEntityTemplateDef",
  "description": "RPG-extended entity template, replacing the core \u0022entity\u0022 def kind: adds loot, starting items, and auto-equipped gear. Stat keys in stats are stat def IDs under the RPG convention.",
  "type": "object",
  "properties": {
    "id": {
      "type": "string",
      "description": "Globally unique def ID."
    },
    "type": {
      "const": "entity"
    },
    "description": {
      "type": "string",
      "description": "One line for humans and LLMs (surfaced by the manifest)."
    },
    "inherits": {
      "type": "string",
      "description": "Parent def ID (same kind); objects deep-merge, scalars override, arrays replace or take {\u0022$append\u0022/\u0022$remove\u0022} patches.",
      "x-lattice-ref": "entity"
    },
    "lootTable": {
      "type": "string"
    },
    "equipment": {
      "type": "array",
      "items": {
        "type": "string"
      }
    },
    "items": {
      "type": "object",
      "additionalProperties": {
        "type": "number"
      }
    },
    "name": {
      "type": "string"
    },
    "tags": {
      "type": "array",
      "items": {
        "type": "string"
      }
    },
    "stats": {
      "type": "object",
      "additionalProperties": {
        "type": "number"
      }
    }
  },
  "required": [
    "id",
    "type"
  ]
}